,title,few,people,time,install,tag,detail
0,99《バーストゲーム》,無料,2~8人,6~15分,不要,盛り上がる対人ボードゲーム対戦, 99を超えたらバースト！簡単気軽なトランプゲーム！ 99《バーストゲーム》は、数字の合計が「99」を超えないように手札を出し合うゲームです。各プレイヤーは3つライフを持っており、「99」を超えるとバーストしライフが1つ減ります。最後の1人になるまで残ることができれば勝利となります。トランプには「数字がそのままポイントが加算されるカード」と「特殊な効果を持つカード」の2種類あります。ゲームの流れとトランプの効果については下記の通りです。   【ゲームの流れ】 ①スタート時に自動で手札3枚が配られます。 ②各プレイヤーは順番に手札から1枚カードを出します。 ③99を超えたプレイヤーのライフが１つ減ります。ライフがなくなるとそのプレイヤーはゲームから除外され観戦モードになります。 ④最後の1になるまで②～③を繰り返します。最後の1人なった人が勝利です。   【カードの効果】 ○数字がそのままポイントが加算されるカード 「２・３・５・６・７・８」……数字分のポイント追加。 ○特殊な効果を持つカード 「1」……加算する数字を１か11のどちらかを選べる。 「４」……ポイント増減せず手順を逆周りにする。 「９」……ポイント増減なし。 「１０」……１０ポイント減算する。 「Ｊ・Ｑ」……１０ポイント追加する。 「Ｋ」……ポイントを９９にする。   ルールがシンプルで初めての人でも楽しめるため、悩んだらとりあえず「99《バーストゲーム》」がで遊ぶのがおすすめです。 その他にも無料でルールが簡単＆短時間で遊べるゲームを紹介しています！ ↓まとめ記事はこちら↓ ボードゲームアリーナで楽しめるおすすめのボードゲーム5選｜魅力や特徴もご紹介！   複数人で遊ぶ方法 このゲームはBGA（ボードゲームアリーナ）で遊ぶ事ができます。BGAに登録してない場合は、まず登録をしましょう。 登録方法は、こちらを参考にして下さい（↓）。BGAがどんなサイトかについても書いてあります。 ボードゲームアリーナの登録方法｜無料でボードゲームを遊べるブラウザゲームサイト   登録が完了したら、フレンドの追加を行いましょう。 リンクを開くとゲームのホーム画面になるので、「スタート」の下にあるプレイヤーにフレンドを追加しましょう。自分のアイコンの右隣の＋（プラス）を押すとフレンド名が検索でき招待することができます。また、「招待リンク」をクリックして表示すると、リンクが表示されるので共有すれば招待することができます。   解説動画はこちら↓  
1,DOBBLE（ドブル）,無料,2~8人,3~5分,不要,盛り上がる対人リアルタイムボードゲーム発想力対戦, 同じマークを探し出せ！判断力・瞬発力が試されるスピードバトル！ DOBBLE（ドブル）［別名：Spot it!］は、手札と山札の2枚のカードに描かれた同じマークを誰よりも早く探し出すゲームです。カードは全部で55枚あり、8つの大小様々なマークが描かれています。2枚のカードには同じマークの組み合わせが1つしかないのでそれを誰よりも早く見つけ出します。最終に所有しているカードの枚数によって勝敗を決めます。ルールがシンプルで1回当たりのプレイ時間も短いので初めての人でも気楽に楽しむことができます。ゲームモードは全部で5つありますが、一般的な「タワーリングインフェルノゲーム」の流れについて紹介します。どのゲームモードも同じマークを見つけることは共通です。   【タワーリングインフェルノゲームの流れ】＊ブラウザ版では〈〉は自動で行います。 ①〈各プレイヤーに裏向きにカード1枚を配り、残りを表向きに山札として中央に置きます。〉 ②各プレイヤーは一斉にカードを表向きにし、山札のカードのマークと自分のカードの共通マークをいち早くクリック（宣言）する。 ③最初にクリック（宣言）できたプレイヤーは山札からそのカードを獲得できます。 ④山札が尽きるまで②～③を続け、最後に最もカードを獲得したプレイヤーの勝利となります。   複数人いる場合は、トーナメント形式にやっても楽しめます！ DOBBLE（ドブル）の他にも、無料で簡単・短時間で遊べる、頭を使うボードゲームや協力プレイできるボードゲームを紹介しています！ ↓まとめ記事はこちら↓ ボードゲームアリーナで楽しめるおすすめのボードゲーム5選｜魅力や特徴もご紹介！   複数人で遊ぶ方法 このゲームはBGA（ボードゲームアリーナ）で遊ぶ事ができます。BGAに登録してない場合は、まず登録をしましょう。 登録方法は、こちらを参考にして下さい（↓）。BGAがどんなサイトかについても書いてあります。 ボードゲームアリーナの登録方法｜無料でボードゲームを遊べるブラウザゲームサイト   登録が完了したら、フレンドの追加を行いましょう。 リンクを開くとゲームのホーム画面になるので、「スタート」の下にあるプレイヤーにフレンドを追加しましょう。自分のアイコンの右隣の＋（プラス）を押すとフレンド名が検索でき招待することができます。また、「招待リンク」をクリックして表示すると、リンクが表示されるので共有すれば招待することができます。     プレイ動画はこちら↓  
2,BANDIDO（バンディド）,無料,1~4人,7~15分,不要,パズル盛り上がる協力ボードゲーム発想力, 仲間と協力して盗賊を閉じ込めろ！協力型ボードゲーム！ BANDEDO（バンディド）はプレイヤー同士が協力して、盗賊のトンネルを全て封鎖し脱獄の阻止を目指すゲームです。 ルールがシンプルであり1ゲームの時間が短いので、全員協力型のボードゲームですが初めての人でもすぐに始めることができます。 各プレイヤーは3枚の道が描かれたカードを順番に置いていき道をふさぎます。山札がなくなる前に道をふさげれば勝利！ふさげなければ敗北...となります。 ゲームの細かい流れは次の通りです。   【ゲームの流れ】 ①各プレイヤーは山札から3枚ずつ道カードを受け取ります。（他のプレイヤーのカードは見ることができません） ②1番目のプレイヤーから道カードを順番に置いていきます。この際注意点があり、道カードは必ず全ての道がつながるように置かなくてはいけません！ただ、道がつながるのであれば縦置き横置きでも大丈夫です。 カードを置き終わったら山札からカードを1枚引きます。（もしカードが置けない場合は、手札を全て捨てて山札から3枚引きます。） ＊山札は合計69枚あり、通常の道カードが24種類×2枚で48枚、行き止まり道カードが7種類×3枚で21枚あります。 ③次のプレイヤーに移り、②を繰り繰り返していきます。山札がなくなる前に道をふさげば勝利となります。   仲間の手持ちカードを考えながら協力して閉じ込められた時の達成感を是非味わってみてください！ BANDEDO（バンディド）の他にも無料でルールが簡単＆短時間で遊べるゲームを紹介しています！ ↓まとめ記事はこちら↓ ボードゲームアリーナで楽しめるおすすめのボードゲーム5選｜魅力や特徴もご紹介！   複数人で遊ぶ方法 このゲームはBGA（ボードゲームアリーナ）で遊ぶ事ができます。BGAに登録してない場合は、まず登録をしましょう。 登録方法は、こちらを参考にして下さい（↓）。BGAがどんなサイトかについても書いてあります。 ボードゲームアリーナの登録方法｜無料でボードゲームを遊べるブラウザゲームサイト   登録が完了したら、フレンドの追加を行いましょう。 リンクを開くとゲームのホーム画面になるので、「スタート」の下にあるプレイヤーにフレンドを追加しましょう。自分のアイコンの右隣の＋（プラス）を押すとフレンド名が検索でき招待することができます。また、「招待リンク」をクリックして表示すると、リンクが表示されるので共有すれば招待することができます。   是非、友人や家族とBANDEDOで協力プレイを楽しんでみてください。   プレイ動画はこちら↓  
3,トゥーンブラスト（Toon Blast）,基本無料,1人,3~10分,必須,チーム戦発想力, ＊PR アイテムの組み合わせを駆使して難解パズルを攻略せよ！   トゥーンブラスト（ToonBlast）はシンプルながら奥深いパズルゲームであり、先の先を考えながらプレイするのが好きな人にオススメなゲームです。 操作はシンプルで、ブロックをタップするだけです。同じ色の上下左右に隣り合った2つ以上のブロックを消し、各ステージに設けられたクリア条件をムーブ数（回数制限）内で、達成していくことを目指していきます。様々な形状のステージやギミックの中、全ての風船や箱を破壊することや泡に包まれたブロックを消す等色々な種類のクリア条件があり飽きることなくプレイできます。1ステージは3分ぐらいで終わるのでちょっとした空き時間の暇つぶしにもおすすめです。   トゥーンブラストにはよくあるようなコンボ消しはありませんが、一定数のブロックを同時に消すとアイテムが出現します。アイテムは全3種類で「ロケット」、「爆弾」、「ディスコ」があります。また、アイテム同士を隣り合うよう置くと組み合わせて使う事ができ、通常よりも多くのブロックを消す事ができます。尚、組み合わせは2種類のみとなり、3つ以上組み合わさった場合、「ディスコ」＞「爆弾」＞「ロケット」の優先順位で組み合わせが決定されます。 （例）「ロケット」＋「爆弾」＋「ディスコ」の3種類は、「ディスコ」＋「爆弾」の組み合わせとなります。 ステージクリアには、アイテムの使用が必須になるので必ず特徴については押さえておきましょう。   【アイテムの特徴と組み合わせ】 ・「ロケット」（5～6個同時消し） ロケットの方角に向かって縦または横の一列を全て消します。 ・「爆弾」（7～8個同時消し） 爆発して3×3マスの範囲を全て消します。 ・「ディスコ」（9個以上同時消し） ディスコと同じ色のブロックを全て消します。 ・「ロケット」＋「ロケット」（組み合わせ） 縦1列、横1列を全て消します。 ・「爆弾」＋「爆弾」（組み合わせ） 7×7マスの範囲を全て消します。 ・「ディスコ」＋「ディスコ」（組み合わせ） 全てのブロックを消します。（ディスコの色は関係ないです） ・「ロケット」＋「爆弾」（組み合わせ） 縦3列、横3行を全て消します。 ・「ロケット」＋「ディスコ」（組み合わせ） ディスコと同じ色のブロックがロケットに変わります。 ・「爆弾」＋「ディスコ」（組み合わせ） ディスコと同じ色のブロックが爆弾に変わります。 「ディスコ」＋「ディスコ」と「ロケット」＋「ディスコ」の組み合わせが様々なステージに効果的なのでオススメです。 上記の他にも使用回数制限があるスペシャルアイテムやサポートアイテムがありますが、貴重なので後半の理不尽なステージに使用するようにしましょう。   オンラインチームへの参加 トゥーンブラストではチームに参加することができ、メンバー間で雑談や攻略法の共有を行ったりと、みんなで協力しながら楽しむ事ができます。 チームに参加すると、「チームトーナメント」への参加が可能になったり、ライフをもらえたりとメリットがあります。ただし、「チームトーナメント」に参加する場合は10人以上必要となるので注意が必要です。 是非仲のいい友達や家族と協力しながら楽しんでみてください。   解説動画はこちら↓  
4,SKULL（スカル）,無料,3~6人,5~15分,不要,盛り上がる推理対人ボードゲーム対戦, 勝利の花か死のドクロか。SKULLで駆け引きの極限へ SKULL（スカル）は、心理戦とブラフが魅力のボードゲームです。ルールがシンプルで、手軽にプレイヤー同士の駆け引きを楽しむことができます。運も重要な要素になりますが、洞察力と戦略性次第では勝利することができるゲームです。このゲームは、花とドクロの2種類のディスクを使ってプレイします。各プレイヤーが伏せたディスクの内、花ディスクの枚数を予想して宣言して2回当てることができれば勝利となります。ドクロディスクを引いてしまうとアウトとなりペナルティが与えられます。 ゲームの細かい流れは次の通りです。   【ゲームの流れ】①    プレイヤーは、初めに4枚のディスク（3枚の花と1枚のドクロ）を持っています。②    毎ラウンドの初めに、すべてのプレイヤーは伏せた状態で場にディスクを1枚ずつ置きます。③    置き終わったらスタートプレイヤーから画面上部のバーから次のアクションを選択します。A：花をプレイする手持ちの花ディスクを自分のディスクに重ねます。ない場合は置けません。終了したら次の人に代わり、アクションCが選択されるまで続けます。B：ドクロをプレイする手持ちのドクロディスクを自分のディスクに重ねます。ない場合は置けません。終了したら次の人に代わり、アクションCが選択されるまで続けます。C：数字場に出ているディスクの内、裏返すディスクの枚数を宣言します。場に出ているディスクの枚数分の数字を選択できます。（花ディスクの枚数を当てるようにしましょう）④    アクションCが選択されたら、各プレイヤーは順番に、「他のプレイヤーの宣言枚数より多くの枚数を宣言する」か「パス」するかを選択します。最終的に宣言枚数の多いプレイヤーがディスクを裏返します。⑤    裏返すプレイヤーはまず、自分のディスクを全て裏返します。宣言枚数に達しない場合は、他のプレイヤーのディスクを上から順に裏返す事ができます。⑥    宣言枚数を裏返し、全て花ディスクであればそのプレイヤーに1ポイント入ります。（2ポイント獲得で勝利となります）。尚、スカルを引いた場合は、そのプレイヤーのディスクから1枚ランダムで減らして②から再スタートします。この時点でディスクがなくなったプレイヤーは負けとなります。   ブラフをうまく使いこなし、ぜひ心理戦を楽しんでみてください！ SKULL（スカル）の他にも、無料で簡単・短時間で遊べる、頭を使うボードゲームや協力プレイできるボードゲームを紹介しています！ ↓まとめ記事はこちら↓ ボードゲームアリーナで楽しめるおすすめのボードゲーム5選｜魅力や特徴もご紹介！   複数人で遊ぶ方法 このゲームはBGA（ボードゲームアリーナ）で遊ぶ事ができます。BGAに登録してない場合は、まず登録をしましょう。 登録方法は、こちらを参考にして下さい（↓）。BGAがどんなサイトかについても書いてあります。 ボードゲームアリーナの登録方法｜無料でボードゲームを遊べるブラウザゲームサイト   登録が完了したら、フレンドの追加を行いましょう。 リンクを開くとゲームのホーム画面になるので、「スタート」の下にあるプレイヤーにフレンドを追加しましょう。自分のアイコンの右隣の＋（プラス）を押すとフレンド名が検索でき招待することができます。また、「招待リンク」をクリックして表示すると、リンクが表示されるので共有すれば招待することができます。   是非、SKULLで究極の駆け引きを味わってみてください！    
5,CATAN（カタン）,基本無料,1~4人,30~90分,不要,対人ボードゲーム対戦, 資源を巡る戦略と交渉の舞台、カタンで未来の開拓者へ！ 「カタン」は、島を開拓して資源を収集し、勝利ポイントを獲得する戦略的なボードゲームです。 プレイヤーは獲得した資源から、開拓地や都市を建設し発展させることで勝利ポイントを得ることができ、 一定の勝利ポイントを先に達成したプレイヤーが勝利となります。(無料版は10ポイントで勝利)   2分でざっくりわかる！ゲームの流れと基本ルール ○初めの作業 それぞれのプレイヤーは拠点(街道＋開拓地のセット)を2回設置します。 設置する順番はA→B→C→D→D→C→B→Aの通りとなります。(3人の場合はDがなくなります) ～設置のポイント！～ タイルの数字の下の点が多い程、資源を獲得する確率が高くなります。 赤い数字のタイルが最も確率が高くなるので初めのうちはそこを中心に設置しましょう。 ○基本的なゲームの流れ 基本的な作業は①さいころを振る（資源を獲得） →②建設 (資源の支払い)と③交渉（資源の交換）の主に3つとなります。 ○勝利ポイントの貯め方 以下のアクションをすると勝利ポイントが加算されます。合計で10点になるように目指しましょう。 尚、初めの作業で開拓地を2つ建設するので全員2点持っている状態から始まります。 １．開拓地の建設＝1ポイント ２．都市の建設＝2ポイント ３．5つ以上の街道の建設＝2ポイント ４．3回以上の騎士カードの使用＝2ポイント ＊3と4とについては常に最も多いプレイヤー1人のみ加点対象となるため注意が必要です。   ① さいころを振る（資源を獲得） 資源は、「木材」、「土」、「羊」、「麦」、「鉄」の5種類あります。 プレイヤーはさいころを2つ振ることで、出目の合計に対応したタイルから資源を獲得することができます。タイルに相手の拠点がある場合は、相手にも資源が配られます。 ＊さいころの出目の合計が7の場合（盗賊の移動） 「7」が出た時のみ、資源の獲得はできず次のアクションを行います。 １．手持ちの資源が7枚を超えるプレイヤーは半分捨てます。(奇数の場合は切り捨て。9枚の場合は4枚） ２．「7」を出したプレイヤーは盗賊を好きなタイルへ移動させます。＊盗賊がいる限りそのタイルでは資源は獲得できなくなります。 ３．移動させたタイルに拠点があるプレイヤーの内、1人からランダムで1枚資源をもらいます。 ４．交渉をフェーズに移り終わり次第、次のプレイヤーに代わります。   ②建設 (資源の支払い) 獲得した資源を支払うことで「街道」、「開拓地」、「都市」の拠点の建設や「発展カード」を得る事ができます。 自分のターンであれば何度でも行う事ができます。 【街道】(木材×1、土×1) タイルの辺に設置することができ、主に自分の拠点を増やす際に建設します。 ・建設条件 １．自分の拠点とつながっている事 ２．他のプレイヤーの開拓地や街道が建設されてない事 【開拓地】(木材×1、土×1、羊×1、麦×1) タイルの角に設置することができます。建設したタイルの数字が出れば資源を1枚獲得できます。 ・建設条件 １．自分の拠点とつながっている事 ２．別の開拓地から2つ以上離れている事 【都市】(麦×2、鉄×3)  開拓地を強化して資源の獲得が2倍になります。 ・建設条件 １．自分の開拓地が建設されている事 【発展カード】(羊×1、麦×1、鉄×1)  主に盗賊を移動させる「騎士カード」や資源を得られる「進歩カード」、勝利ポイントが加算される「勝利ポイントカード」があります。仕様タイミングはカードの枠が緑色に光っている時のみになります。 プレイ中は建設コストが一覧にされたカードを参考にするのがおすすめです。   ③交渉（資源の交換） さいころを振った後、他のプレイヤーや貿易を通じて資源の交換が行えます。 交換の際はさいころの隣りにあるアイコンから行えます。 ・プレイヤーとの交換 渡す資源、欲しい資源を選ぶと全員に通知が届きます。複数人が交渉に応じた場合は、その中から1名を選びます。 ・貿易との交換 自分：相手＝4:1のレートで交換することができます。港のマスに自分の拠点が設置されている場合は、これより少ないレートで有利に交換を行う事ができます。？マーク=3:1、各資源のマーク＝2:1でレートで交換できます。   オンラインで友人と対戦する方法 カタンユニバースではカスタムマッチで友人とオンライン対戦を楽しむことができます。 ただし、無課金の場合は、3人迄となりますので注意して下さい。 4人でプレイする場合は、全員が基本ゲームを購入している必要があります。 以下に、プレイするまでの流れを簡単に説明します。 カタンユニバースは残念ながら日本語に対応してませんが直観的にできるので仕様なので心配いらないです！ ・プレイまでの主な流れ ①ユーザー登録 ②ルームの作成 ③みんなでプレイ！   ①ユーザー登録 １．TOP画面の「REIGISTER」（登録）を押します、 ２．「メールアドレス」、「ユーザーネーム」、「パスワード」、「パスワード再入力」を入力します。 ３．利用規約にチェックを入れて、「ACCEPT」（承認）を押します。 ４． 最後に「REIGISTER」（登録）を押します。 ５．メールに5文字の英数字が送られてくるので、それをコピーして下さい。 ６．カタンユニバースの画面の「Code」(記号)に貼り付け、「ACTIVATE WITH CODE」（コードで起動）を押せば登録完了です。   ②ルームの作成 １．登録後、「NOT NOW」(チュートリアルを今はしない)を選択して「MULTIPLAYER」（マルチプレイヤー）を選択して下さい。 ２．「The Game」（ザ　ゲーム）を選択し、「CUSTOM MATCH」（カスタムマッチ）を選択するとフレンドの待機画面になります。 ３．「Add player」（プレイヤーを加える）を押して友人の名前を検索して追加します。AIキャラを追加したい場合は、「COMPUTER(AI)」を選択することで追加できます。   ③みんなでプレイ！ 全員揃ったら「START GAME」を押してプレイしましょう！！   詳しいルール解説はこちら↓  
