,title,few,people,time,install,tag,detail
28,雀魂 -じゃんたま-,基本無料,1~4人,30~60分,不要,ボードゲーム対戦, ZOOMしながらみんなで遊ぼう！ zoomなどのオンライン会議ツールと連携してクイズやゲームを楽しめます。 ログイン不要！URLを作成して共有するだけでプレイできるので気軽にできます。   コンテンツの種類は全部で6種類！ 一致するまで終われまテン…お題に対して全員一致の回答を目指す、相性ゲーム 押したのだぁ～れ？…質問に対してYESを回答した人数のみ表示される。匿名アンケート機能 何の絵を描いているでしょうか？…出題者が描いている絵を、30秒以内に当てるゲーム 早押しシステム…効果音と早押し機能がついた便利機能 NGワード…参加者に割当られたランダムなNGワードを言ったら負け イチマルマル…順番に３回までボタンを押し、100回目のボタンを押したら負け 盛り上がるものばかりなので、オンライン飲み会やリモート会議などにぴったりです！    
29,ラウンジ,基本無料,2人~,5~120分,不要,盛り上がる発想力対戦, 誰よりも大きなミミズ？を目指せ！ 世界中のプレイヤーが常に参戦している多人数参加型オンラインゲームです。 ステージに落ちている光る玉をひたすら集めてスコアで競い合います。 制限時間はありませんが、頭をほかのプレイヤーに当ててしまうとそこでゲームオーバーです。   スコアを稼ぐほど本体が長くなり、太くなります。 敵の頭を自分の体にぶつければ敵が集めていたスコアが放出されるため、効率的にスコアを稼げます。 またダッシュをすることができますが、体が大きいほどスコアを大量に消費してしまうため注意が必要です。   【操作方法】 移動：マウスの方に向かって進みます。←キーで左回転、→で右回転します。 ダッシュ：マウスの右クリックもしくは↑キーでできます。 スキンはスタート画面左下から変えられます。   ～類似オススメゲーム～ Agar.io(アガー)　捕食！分裂！生き残って巨大な細胞を目指せ！   スリザリオ攻略法 【序盤】 ○動く光る玉を優先的に集める 動く光る玉は動かない玉よりスコアが大きいので序盤では優先的に狙っていきましょう。 動く光る玉は近づくと逃げてしまうので、近づいたらダッシュがオススメ！ ○操作に自身のある人は密集地帯へ 右下にレーダーがあり、白い部分が光る玉が多いエリアになるのでそこに向かいましょう。 もちろんライバルも多いため激戦区になりますが、その分光る玉も多いので短期的にスコアを稼ぐことができます。 密集しているため、事故が多くなるので気を付けましょう。たまに、大物のおこぼれもいただけます...   【中盤】 ○ライバルを囲って倒す スコアが2000くらいになったら、ライバルを囲って倒してスコアを奪うことができます。 ダッシュを駆使して気づかれないように囲んで自分の頭とおしりをくっ付けてれば、相手は逃げられません。 そのまま、ジワジワと狭くして相手のスコアを頂きましょう。（囲む分自分も小さくなり襲われるので注意） ○密集地を避ける 大きくなったら囲んで奪う方法ができるので、リスクを避けるため、ライバルの少ないエリアに向かいましょう。 密集地にとどまると事故が多くなるので、避けるのがオススメです。   【終盤】 ○囲んでいるライバルを囲む 囲んで奪おうとしているライバルが近くにいたらチャンスです。 囲んで奪うためにライバルはどんどん小さくなります。そこを狙いましょう。 ただ、自分より大きいライバルが来たら撤退も肝心です。 ○ひたすら大きくなろう このゲームは大きければ大きいほど有利です。 ひたすらライバルからスコアを奪って大きくしていきましょう。 最後は集中力との闘いになります。   是非、ランキング1位を目指しましょう！ 上位プレイ動画はこちら↓  
30,Slither.io (スリザリオ),無料,1人,1~30分,不要,対人リアルタイム対戦, 定時に帰れ！非対称型のオンラインマルチ退社ゲーム 舞台となる会社はとんでもないブラック企業。 世界中のプレイヤーとマッチングして、協力して上司から逃げつつ定時退社を目指します。 5人同時プレイのゲームで、4人は社員、1人は上司に分かれます。 社員は定時3分以内に退社を目指します。 しかしそこはブラック企業！ドアには鍵がかかっており労基に電話しないと開けてもらえません。 上司になったプレイヤーはひたすら社員に仕事を押しつけ退社を妨害します。 定時で帰るか！朝まで仕事か！壮絶な戦いが幕を開けます。   友達と最大5人までプレイ可能！ 最大5人まで同時に遊ぶことが可能です。 4人以下でもBOTが足りない分を補ってくれます。 ＊ただしBOTに過度の期待は厳禁。    
31,定時退社オンライン,基本無料,1~5人,15分,必須,対人チーム戦協力リアルタイム対戦, 弾いて！ぶつけて！突き落とせ！ 相手の消しゴムを落とせば勝利！ 懐かしの誰もが知っている消しゴム落としがゲームで登場！   様々な文房具がステージにちりばめられていたり、 回転させて弾いたりと、種多様な戦略で対戦が可能です。   使える消しゴムは100種類以上もあり種類豊富です。 また、定規や鉛筆を組み合わせて自分オリジナルの消しゴムを作成可能です。   オンライン対戦可能！ 自分オリジナルの消しゴムを使って全国のプレイヤーと対戦可能です。 また、友人などとルームを作ることもでき、最大4人まで同時に遊べます。    
32,消しゴム落とし,基本無料,1~4人,5~15分,必須,対人対戦, 棒力でぶちのめせ！棒人間対戦ゲーム 棒人間を操り、走って跳んで戦い抜け。爽快アクションゲーム！ 4人の自由参加型バトルでは自分以外が敵！様々なギミックがあるすステージを9戦した後に、4人の中のトップが決まります。 様々な種類の武器やコスチューム、ステージなど毎回変わる対戦に飽きません！   １回の対戦は1分もかからず決着が決まるためアクションが得意な方におすすめです。 また、最大３人で遊べるので友人を誘ってみんなで愉快にバトルできます。      
33,Stick Fight: The Game Mobile,基本無料,1~4人,10~20分,必須,対戦, 大喜利で発想力を試そう   大喜利オンラインは自動で表示される大喜利にお題に答え、他の人が面白いと評価した時にもらえる座布団を獲得していくゲームです。    『ちょっと前向きになれるかもしれない言葉』大賞に輝いた言葉とは？    このようなお題が表示されます。 あなたは面白い回答が思いつきますか？   楽しみ方   ルームを作ることで友達と一緒に遊ぶことができ、人数が足りなかった場合にはオンラインのプレイヤーが参加してくれます。 一人でオンライン上の参加者と大喜利をしてももちろん面白いですが、友達と通話しながら行うと自分の回答に対して直接リアクションがもらえたり、他の人が面白い回答をした時に笑い合えるのでより楽しめます。   時間制限があるので回答が思いつかないとかなり焦りますが、普段しない思考をするので、そういった点も楽しみの一つです。   座布団を集めてあなたの発想力を証明しましょう   もっと詳しく知りたい方や面白い回答例を見たい方、下記の動画をチェック    
34,大喜利オンライン - みんなでリモート大喜利,無料,1~4人,10~30分,必須,発想力対戦, みんなでつなげる絵しりとり オフライン、オンラインどちらでも絵しりとりをして友達と遊べるアプリです。 モードは「オンラインモード」と「オフラインモード」の2種類あります。   「オンラインモード」では、プライベートルームを作って4人の友達と遊ぶことや フリールームに参加して1人で遊ぶことができます。   「オフラインモード」は自分のスマホ1つを回して友達と遊ぶことができます。 イラストを書く回数は12回あるので、最大12人の友達と遊ぶことが可能です。 ＊オススメ参加人数は4～6人。オンラインモードは4人でしかプレイできません。   遊び方は簡単です。 最初の文字と最後の文字が表示されるので 上手くしりとりができるように順番にイラストを描いていきます。   制限時間は１分間。 細かく描くと時間が足りず、だからと雑に描くと分からない！絶妙な制限時間です。 「ん」や「―」で終わる場合は、一つ前の文字でしりとりをするので 何でもいいので時間内に書き終えることを目指しましょう。 イラストを書き終えたら書いた物の名前を書きましょう。（ほかの人には見えません）   オンラインモードでは下に表示されている吹き出しをタップするとコメントを飛ばすことができます。 「うまい！」や「わかった！」などはもちろん「うそだろ…」「ｗｗｗ」といったコメントできるので、 書く人はみんなの反応を見ながら進めましょう。   最後の絵を書き終えると結果発表！ 名前をもとにしりとりが成り立っているか、正答率が発表されます。 え、このイラスト○○だったの！？なんてこともあり盛り上がります！   【インストール不要！ブラウザで遊べるお絵かき伝言ゲームはこちら↓】 Gartic Phone　～イラストでお題を伝言するゲーム～【最大30人で遊べるお絵かきクイズはこちら↓】 ピクトセンス　～気軽にみんなとお絵かきクイズ！～   オンラインで友達と遊ぶ方法 タイトル画面をタップしたら「オンラインで遊ぶ」、「この端末だけで遊ぶ」が表示されるので 「オンラインで遊ぶ」を選択しましょう。   4人の内1人は、「プライベートルームを作る」を選択し、ルーム名を入力して下さい。 ルーム名を入力すると待機画面が出るので、残りの3人が参加するのを待ちましょう。   残りの3人は、「プライベートルームに参加」を選択し、ルーム名を入力して下さい。 部屋が見つかると自動的に待機画面に行くので4人揃うまで待ちましょう。   4人揃い次第ゲーム開始になります。 ＬＩＮＥ等で通話しながらやると盛り上がるのでオススメです。        
35,棒レンジャー,無料,1人,30~360分,不要,対戦RPG, 4人の棒人間のアクションRPGゲーム！ 豊富な種類の職業やステータス、アイテムのカスタマイズで自分だけのパーティーを作り 洞窟や砂漠、森などに潜むモンスターを倒していくRPGゲームです。  VSモードで世界中のプレイヤーと対戦可能！ 自分がカスタマイズしたパーティーを世界のプレイヤーと対戦することができます。 攻撃力で重視のパーティー、遠距離特化型のパーティーなど自分だけの戦略で 世界1位を目指しましょう。   基本操作 移動：右クリックでドラックのみ（自動歩行機能付き） 攻撃：射程圏に入れば自動で攻撃します。  
36,虚構新聞,無料,1人,5~15分,不要,, 嘘記事のニュースサイト 時事ネタを取り入れ面白くアレンジし、本当のような嘘の記事をがたくさん載っている新聞です。時々真実だと思い込み拡散してしまう人がいるほどのクオリティのため取り扱い注意！ 基本アプリ版（OS、Android）も出ておりいつでも最新の虚構ニュースが閲覧可能です。 
37,Amang Us（アモングアス）,基本無料,4~15人,10~40分,必須,, 宇宙船に潜む Impostor を見つけ出し追放せよ！ 最小4人から大人数までプレイ可能！ 限られた情報、プレイヤーとのやり取りでそれぞれの目的達成を目指していく宇宙版人狼ゲームです。 Windows・PC（Steam）、iOS、Android、及びNintendo Switchで遊ぶことができます。 iOS、Androidは無料でプレイ可能。Windows・PC（Steam）Nintendo Switchは520円となります。 Among Usのルールは簡単！ プレイ開始時、プレイヤーたちはクルーメイト（宇宙飛行士）とインポスター（偽物）どちらかにランダムで選ばれます。 クルーメイトは、タスクをこなし宇宙船を修理して脱出するか、インポスターを探し出し追放することができれば勝利。 インポスターは、クルーメイトを殺害し自分たちと人数が同数になれば勝利。   ゲーム中はマイクを切ってプレイします。 クルーメイトは周りの行動に注意しつつもタスクを早く終わらせることに集中し、 インポスターは様々な妨害工作を駆使してクルーメイトの妨害、殺害を行います。 怪しいプレイヤーもしくは死体を発見したら、 緊急会議を開き誰かインポスターか話し合いし、多数決で追放します。 クルーメイト、インポスター共にアリバイを作ることが勝利のカギになります！     Youtube  
