,title,few,people,time,install,tag,detail
15,Vampire Survivors（ヴァンパイアサバイバーズ）,基本無料,1人,1~30分,不要,サバイバルリアルタイムタワーディフェンス, 迫りくる吸血鬼やモンスターから生き延びろ！   迫ってくる吸血鬼やモンスターを倒しながら30分間生き残るゲームです。 操作はシンプルで十字キーでの移動するだけです。攻撃は自動で行ってくれます。   モンスターを倒すと宝石（経験値）が落ちるので拾い集めましょう。 一定の経験値がたまるとキャラクターがレベルアップして 新たな武器やアイテム、又は強化を行う事ができます。 新しい武器を入手しても今までの武器は消えずに 今までの武器と新しい武器の両方を同時に使い攻撃することができます。 アイテムも同様に効果が重ねられます。 レベルアップによって出てくる武器やアイテムはランダムになっており 一度選ぶと変更ができないので注意しましょう。   モンスターは、時間がたつにつれて数が増えたり強くなってきます。 また一定の時間ごとにボスが現れます。ボスを倒すと宝箱が落ち 武器やアイテムを入手できるので必ず倒すようにしましょう。   最終強化までした武器とあるアイテムを所持した状態で 宝箱を開くと、上位互換の武器を手に入れることができます。 武器とアイテム（1:1）の組み合わせによって様々な上位互換武器が 手に入るので、是非組み合わせを見つけてみて下さい。   ある条件をクリアすると新たなキャラクターが追加されます。 キャラクターごとに特殊能力が異なるので自分に合ったキャラクターを 見つけて30分間生き延びましょう。   攻略法 ○序盤（開始～10分） ひたすら敵を倒して宝石（経験値）を集めてレベルアップしましょう。 新しく武器を選ぶ際は、キャラクターの初期装備を考慮して選びましょう。 初期装備が遠距離武器なら近距離武器や、単体攻撃なら範囲攻撃できる武器を 選ぶと様々な場面を攻略できます。 慣れてきたら、上位互換の武器が出る組み合わせを選ぶのがおすすめです。 上位互換の組み合わせを少しだけ紹介すると 【アックス＋キャンドル】や、【魔法の杖＋空白の書】等があります。   ○中盤（10分～20分） この辺りから難しくなり 強力なモンスターや画面を埋め尽くすような量のモンスターが出てくるようになります。 積極的にボスを倒し宝箱を取り、最低でも1つは上位互換の武器を手に入れることが必須です。 急に花のモンスターに囲まれることがありますが、一定時間で消滅します。 中にいるモンスターを倒しきるか、一点突破で潜り抜けましょう。 武器の種類が偏りすぎると攻略が難しくなります。 武器を選ぶ際は、バランスよく選ぶことが大切になります。   ○終盤（20～30分） ここまでくると比較的安定に進めることができます。 今までボスだったモンスターも現れますが、 慎重に進めれば倒すことができます。 一定のレベルまで行くと武器やアイテムが出なくなります。 その代わりにお金やお肉と交換できるようになります。 今後のキャラクターの強化のためにもお金を集めるのがおすすめです。 30分経過すると死神が現れて確実に殺されてゲームクリアとなります。 （一部死神を倒す方法もあるらしいですが...）   一昔前のようなゲームですが、奥深く大量の敵を倒す爽快感が癖になり 一度やると時間を忘れてしまうぐらいハマれます。 是非プレイしてみてください。 Steamでも300円で購入可能です。   実際のプレイ動画はこちら↓  
16,LifeAfter（ライフアフター）,基本無料,1~4人,60~120分,必須,ゾンビサバイバル協力クラフトシューティングリアルタイム, ゾンビだらけの世界で仲間と協力し拠点を築くサバイバルゲーム   感染者から身を守って生き残る事が目的のゲームです。 自分で武器や家を作り、仲間と協力して感染者と戦いながら生き残りを目指します。   感染者から生き延びるには、武器や拠点となる家を作る必要があります。 木や石などの素材で作ることができますが全て自分たちで集める必要があります。 武器や家だけではなく、ドローンや回復アイテム、調理した食べ物など、 色々なものを自分で作りながら進めていくので、 必要な素材や数、作り方も習得する必要があります。   素材の種類は100種以上と多いことから、様々な物が作成でき、 ランクの高いものを作るには、より貴重な素材が必要になります。   素材集めは感染者がいる場所で行うのが主になるので、 感染者から身を守る武器を作ることを最優先に進めて、 戦いながらスキルを強化するのがおすすめです。   拠点となる建築物については、 屋根や壁などオリジナルティ溢れる間取りの建築可能なので 自分だけの建物を作りましょう。     このゲーム進めるためには、必要なチュートリアルをしっかりこなし理解して行くことが大事です。 やるべき事は左上に指示として表示されるので、初めての人でもその内容に添って進めていけば、迷うことはありません。 また、何をすればいいのか、分からなくなった時も左上の指示を確認すれば、効率的にクリアが出来るのでしっかりと確認をして進めましょう。   ↓チュートリアル後で迷った方はこちらを参考にして下さい。  
17,Minecraft（マインクラフト）,基本無料,1~8人,15~120分,必須,サバイバル協力クラフトリアルタイム発想力RPG, とにかく自由度の高いサンドボックス型オンラインゲーム Minecraft（マインクラフト）は、2009年にClassic版が登場してからずっと人気のある スウェーデン発のサンドボックス型オンラインゲームです。 仮想の世界で冒険を楽しんだり、もの作ったり建築などを自由に楽しむことが出来ます。 スマホやパソコン、タブレット、Nintendo SwitchやPlayStation4といった 家庭用ゲーム機などいろいろな機種に対応しているのが特徴で、 箱庭のような架空の世界の中に用意されたいろいろな素材やアイテムを使って 自由に遊び方を考え実行することができて不思議な魅力のあるゲームです。   Nintendo Switchでは、サバイバルモードとクリエイティブモードの2つのモードが楽しめて、 分割画面なら最大4人、オンラインなら最大8人まで様々なプレイスタイルで楽しむことが出来ます。 昔のゲームのような雰囲気で、感動するストーリーがあるわけでもグラフィックが素晴らしいわけでも 音楽が素晴らしいわけでもありませんが、何でもできて自由すぎるので中毒性が高く、 いざ始めるとどんどんはまっていき、なかなかやめられなくなります。   とにかく自由度の高いゲームで、自分の好きな世界を作ったり、 仲間と協力して世界を作ったり、どこまでもはまれる最高のゲームです。  
18,リバーシ（オセロ）,無料,1~2人,15分,不要,ボードゲーム対戦, すぐ！簡単！みんなとリバーシ！ ボードゲームのリバーシのゲームです。 ゲスト参加も可能で無料登録をしなくてもブラウザ上で遊べるのが気軽に遊ぶことができます。 リバーシの操作方法は、マスをクリックするだけです。 石を反対の色にめくり最後に自分の色が多く残っていれば勝ちです。 ニックネームを入れて同意する画面をクリックし、空きの部屋に見つけて入るだけです。 平日だと人が少ないため、休日のプレイの方が待ち時間なくプレイできます。 慣れてきたらレート戦もおすすめです。 レート戦は勝つとスコアが大きくなり、負けると減ってしまう戦いなので慣れてきてからがおすすめです。   友達と遊ぶ際、自分で部屋を作ることも可能です。 部屋の作成では、待ち時間やチャット機能のオンオフ、観戦機能のオンオフ、1手時間を細かく設定出来ます。 チャット機能もあるの電車等通話できない場所でも友達とオンラインで遊ぶことができます。   強者が集うレート戦！挑む前には練習必須！ レート戦は人気で、強い相手が沢山います。レートが大きい人はやり込んでいる強者です。 レート戦を楽しむためには通常戦を自分で新しい空き部屋として作るか、 あるいはCPUでテストプレイし、経験を積んでから挑むのがおすすめです。 CPUに挑戦する場合は難易度が3つあります。1や2は初心者でもクリアしやすいですが、3になると難易度が増します。 他人が設定する部屋によっては観戦出来るため、人のリバーシのプレイを見るのも勉強になります。 初回はレートが1000に設定されていますが、実力次第で大きく変化します。   
19,クラッシュ・ロワイヤル（クラロワ）,基本無料,2~4人,5分,必須,リアルタイムストラテジーゲームタワーディフェンス, シンプルだけど奥の深い！プロゲーマーもいるゲーム クラロワは1対1、あるいは2対2での試合対戦を気軽に楽しめるリアルタイムストラテジーゲーム(RTS)です。 100種類以上あるカードの中から8枚を使ってデッキを構築して戦います。 相手の陣地にあるキングタワーやアリーナタワーの破壊すれば勝利となります。 そのためには、デッキ8枚をいかに上手く活かして戦うが重要ポイントとなります。   操作方法は、非常にシンプルです。 試合が開始すると画面下にカード4枚が表示されるので、このうちの1枚を選んでフィールド上にタップするだけです。 画面の一番下に紫色のバーに今自分が所有している「エリクサー」と呼ばれるものの量が表示されており カードに表示されたエリクサー量に到達してはじめてそのカードは使えるようになります。 このエリクサーは時間とともに増え、最大10まで貯めることができますが、 カードを使用するとそのカードごとに設定された数のエリクサーが消費されるので注意が必要です。 クラロワはダウンロードするとチュートリアルが始まり、そこで基本的な操作方法を学ぶことができます。 チュートリアル後は、オンライン対戦ができるようになるので、特定の友達とはもちろんのこと、 オンライン上の誰かわからない世界中のプレイヤーとの対戦を楽しめます。 最初はデッキ構築に使えるカードがあまりないので、しばらくはカード集めをすることをオススメします。  
20,インペリアルサガエクリプス,基本無料,1人,30分,不要,RPG, ゆっくり楽しめるなつかしのRPG ガチャで手に入れたキャラを育ててモンスターやボスモンスターを倒していく王道RPGタイプのゲームです。 ギルドなどがなく対人戦もGvGもないので特に競ったりせずまったりゆったりと楽しめるRPGです。 戦闘は5人のキャラでパーティーを編成し、5マス×5マスのフィールドでコマンドを入力するシステムとなってます。   5人のキャラの内、1人は他のプレイヤーのキャラを借りて戦闘を行うため 自分が弱いうちは他人のキャラに攻撃を任せるだけでもある程度進められるので序盤に困ることはありません。 キャラの育成は敵を倒した経験値を稼ぐ他に、経験値そのものが貰えるアイテムが簡単に大量に手に入るので育成はとても簡単です。 装備もLvもキャラと同じように武器用経験値アイテムがあるので簡単に上げられます。   イベントはほぼ毎週やっており、イベントに有利なる装備やキャラももらえます。最初に無料ガチャやゲーム内マネーがもらえるので序盤からイベントを楽しむことができます。 また、課金してキャラと装備を手に入れることができます。（ガチャ1回は300円）ガチャの天井は装備は70回、キャラは150回分なので他のゲームと比べてもそれほど高くはないです。 ゲーム内マネーもイベント報酬やログインボーナス、ミッションなどで配布されているので毎週10連はできるようになります。   サガシリーズのファンにはオススメ！ 歴代のサガシリーズのキャラや敵キャラ、武器、防具、アクセサリーが出てきます。 SFC版のロマンシング・サガからゲームボーイ版の魔界塔士SaGaシリーズ、 PS版のサガ・フロンティアやPS2のロマンシングサガミンストレルソング、 最新のサガスカーレットグレイスまでと懐かしのキャラを見れたり、 サルーイン戦、七英雄戦、四魔貴族戦、ロマンシングサガミンストレルソングのミニオン戦など のあの名曲や懐かしの名技なども勢ぞろいしているのでファンにとっては 懐かしさと嬉しさが必ず湧くこと間違いないです。    
21,弓矢バトルオンライン,基本無料,1~10人,5分,必須,リアルタイム対戦, 5対5の激アツ！オンライン弓矢バトル！ 5対5のチームに分かれ、お互いに矢を撃ちまくり生き残りを決めるオンライン対戦ゲームです。 横移動か構えて打つのみのシンプルな操作ですが、スタミナの管理、狭まってくる壁など奥の深いバトルが楽しめます。 一定ランクで盾兵も選択可能になり、味方のフォローが得意な人にもおすすめです。 自分がやられても味方を応援して必殺ゲージをためることができ、一発逆転を狙うことも可能！ 最後の一人になって勝利した時の達成感がたまりません！   最大10人の友達とオンラインバトル可能！ 1人が合言葉を決めてルームを作成します。他の人は決めた合言葉を入力してルーム入るだけで気軽にプレイできます。また、10人未満でもCＰＵがはいってくれるのでプレイ可能です。    
22,イラストチェイナー ,無料,2~4人,5~15分,必須,お絵かき推理協力発想力, 5分で決まる立体将棋 シンプルながら奥深い、オンライン2人対戦ボードゲームです。 5×6マスのボード上にある、自分の5つのコマを操作します。 操作は簡単で、自分のターンに1つのコマを1マス動かすだけです。 1試合5分とすぐに決着がつくので、気軽にプレイできます。   ルールもシンプル！ 勝利条件は2つのみ ①1コマでも敵の陣地に入り込めたら勝ち ②相手の全てのコマに乗っかり、足止めできたら勝ち   コマを動かすルールも2つのみですぐに覚えられます。 ルール１：コマは前後左右斜めへ、1マス移動させることができます。 ルール２：1~3 段目まで乗っかることができます。自分と相手のコマに乗っかることができます。動かせるのは一番上のコマだけです。 ＊後者の人は、1つだけ4段目に乗れるコマが与えられます。   頭を使うゲームが好きな友達と遊ぶときにぴったりです。   2人で遊ぶとき ゲームのホーム画面の「ルームマッチ」を選択してください。 ホストの人はルールを決めてルームを作成し、ルームIDを共有してください。 ゲストの人は、「ルームに参加」を選択し、ルームIDを入力してください。   ＊ルーム作成時のルールの用語説明 盤面        ：ボードの大きさを選べます。縦マスを6マスか7マスに選択できます。 先攻/後攻 :ホスト側を先攻、後攻を決められます。 4段コマ    :4段目に乗れるコマの数を決めます。 2段コマ　 :2段目までしか乗れないコマの数を決めます。 のっぽコマ:2段目まで高さのあるコマの数を決められます。 おじゃまコマ：ボード上にある動かせないコマをの数を決めます。 　　　　　　　また設置をランダムか対象に選ぶことができます。   普通のルールじゃ物足りなくなったら、設定を変えるのをお勧めします。    
23,Nocca Noccaノッカノッカ,基本無料,1~2人,5分,必須,ボードゲーム対戦, 3匹vs1人オンライン対戦鬼ごっこゲーム ゲーム開始時、4人の中から1人「ヒト」が選ばれます。 「ゴリラ」はパンチで「ヒト」を吹っ飛ばせば勝利です。 「ヒト」は時間終了まで、ゴリラから逃げ切るか宝石を全て集めることで勝利となります。   ステージはエリアごとに色分けされており、 「ゴリラ」は色で「ヒト」の位置を共有します。 「ヒト」はレーダーが使えるので、「ゴリラ」の裏をかいてうまく逃げましょう。   1試合は約５分ぐらいで、最大4人でプレイできます。 野生の感覚を取り戻せる！ゲームです。   4人以下でも友達とプレイ可能！ ホーム画面左の「Room match」をタップすると友達とプレイできます。 ホストの人は「作成」を選び部屋を作成しましょう。 ゲストの人は部屋を作成後、「入室」からIDを入力して入ります。   部屋作成時に二つのモードが選べます。 「TEAM 」モード（１～3人）：友達とチームを組んでオンラインバトルに参加できます。 「CUSTOM」モード（4人）   ：ルールをカスタマイズして友達同士とバトルできます。 ＊ゴリラになった人は、ヒトの言葉を使って情報を共有しないように注意しましょう！ （ゴリラ語はありです）   
24,ゴリラ・オンライン ,基本無料,1~4人,5分,必須,対人チーム戦サバイバルリアルタイム対戦, オンライン対戦早押しクイズゲーム ランダムマッチ・フリーマッチ(フレンド対戦)の2種類のモードが選べます。 ○ランダムマッチ 　全国のライバルとオンラインで早押しクイズ対戦ができます。 　一人の時におすすめです。 ○フリーマッチ(フレンド対戦) 　友達と、家族と、パーティーで、オンラインで、テレビ番組のような早押しクイズを楽しめます！ 　出題問題は3種類の難易度からおまかせ、またはオリジナル問題を作成して出題可能です。   2人以上の設定方法 　2人で遊ぶ時 　　①ホーム画面の下に並んでいる5つの内、真ん中の「人型アイコン」をタップ。 　　②遊びたいフレンドを選んで「1対1対戦をする」を選び、お互いルームに入れば対戦開始です。 　　　＊フレンド登録をしてない場合は、右下にある「人型に＋が付いたアイコン」をタップして 　　　　プレイヤーIDを入力すれば登録できます。 　2人以上で遊ぶ時、クイズを作成したい時 　　①ホーム画面の「フリーマッチ」をタップ。 　　②ホストの人は、下にある「ルーム作成」をタップ。 　　　モード選択は、自動で読み上げてくれる「オンライン対戦」がおすすめです。 　　　ルームIDが発行されるので、ゲストの人は「ルームID入力」にタップしてIDを入力してください。 　　③対戦ルールを決めたら、対戦開始です。初期設定では1試合当たり10分ぐらいです。   ゲーム配信/ゲーム実況アプリMirrativ（ミラティブ）をインストールすれば、 配信しながら視聴者さんとみんなで協力プレイも可能です。  
25,みんなで早押しクイズ,無料,1人~,10分,必須,盛り上がる対人リアルタイム対戦, ゆる〜く楽しめるインベーダー風シューティングゲーム キャラを横に移動しながら攻撃する対戦型シューティングゲームです。 1試合は2～3分ほどで、1発でも当てれば勝ちとシンプルです。 操作は横移動と攻撃のみです。 スワイプした方向にキャラが自動で進みます。 下にある技名のアイコンをタップするとエネルギーを消費して攻撃できます。流れてくるボックスを破壊して ポイントを集めていくと強力な技が出せます。（強力な技はエネルギーを多く消費するので注意が必要です） フレンドバトルで離れた友達とも遊べます。 共有した合言葉を入力してルームに入るだけで気軽にプレイできます！   シンプルがゆえに奥が深い 個性豊かな「せいじん」を選んでバトルができます。 くねくね曲がる弾を放つ「たこせいじん」や、早い弾が自慢の「うさぎせいじん」などがいます。 また、「せいじん」ごとに、途中で左に曲がるだまし討ちの技や、消える弾など強力な技が用意されています。 様々な「せいじん」と技を組み合わせて、自分だけの戦術を見つけましょう。   強力な技を出すために必要なポイントは、ボックスを破壊した方に流れてきます。 いかに最後に攻撃を当てるか、もしくは当てさせないかが重要になります。 ポイントが相手に流れても弾幕を張り、相手にポイントを取らせないことも可能です。 相手の心理を見抜いて、攻撃を出すタイミングが肝になります。  
26,スターシュートVS,基本無料,1~2人,5分,必須,リアルタイム対戦, 2人遊びに特化したスマホゲーム！ 2人で遊ぶこと特化したスマホゲームです。 ピンポンや、スピナー戦争、相撲などなど... 簡単にプレイできて楽しめるゲームがたくさんあります。 1プレイ当たり5分もかかりません。 スキマ時間でも遊んでもよいですし、複数のゲームの勝ちの数を競い合っても盛り上がります。 1人だけの時はコンピューターが対戦相手になってくれます。 ＊机の上などスマホを置ける場所で遊ぶことをお勧めします。  
27,2 人ミニゲーム : チャレンジ,無料,1~2人,3~5分,必須,対人対戦, 萌え系対戦型麻雀ゲーム！ 多様な対戦モードで、初心者から上級者まで楽しめます。 友人とも対戦可能です。しかも、4人集まらない場合でもＣＰＵが参戦してくれるため いつでも何人でも対戦を楽しむことができます。   キャラが可愛い！ 様々なタイプのキャラクターを使用可能で、ボイスは人気声優を起用しています。 キャラクターには好感度のパラメーターも設定されており、アバターとして使用したり、アイテムを贈ることで好感度を上げることができます。 好感度が上がることで、追加ボイスやアバターのCGが変化する機能の開放など、様々なシーンでキャラと触れ合い関係を深めることができます。 自分だけのお気に入りキャラを育てていきましょう。    
